{
  "title": "Last Month Report",
  "period": {
    "start": "2025-12-01",
    "end": "2025-12-31"
  },
  "generated": "2026-01-02 07:29:42",
  "metrics": {
    "total_revenue": 114956.0,
    "total_notas": 43,
    "avg_ticket": 2673.3953488372094,
    "total_items": 107
  },
  "top_customers": [
    {
      "rank": 1,
      "name": "Grammer",
      "revenue": 39603.0
    },
    {
      "rank": 2,
      "name": "Guaches",
      "revenue": 15088.0
    },
    {
      "rank": 3,
      "name": "Alejandro",
      "revenue": 13365.0
    },
    {
      "rank": 4,
      "name": "Los papis",
      "revenue": 8728.0
    },
    {
      "rank": 5,
      "name": "Oscar vazquez",
      "revenue": 6730.0
    }
  ],
  "top_products": [
    {
      "rank": 1,
      "name": "Arrachera marinada",
      "quantity": 760
    },
    {
      "rank": 2,
      "name": "Bistec de cerdo entero",
      "quantity": 104.5
    },
    {
      "rank": 3,
      "name": "Pulpa/ trozo de cerdo",
      "quantity": 78
    },
    {
      "rank": 4,
      "name": "Pulpa/trozo cerdo",
      "quantity": 46
    },
    {
      "rank": 5,
      "name": "Bistec de res",
      "quantity": 40
    }
  ],
  "records": [
    {
      "Timestamp": "12/7/2025 17:22:48",
      "Remision": "20251207-1020",
      "Fecha": "2025-12-07",
      "Cliente": "Alberto",
      "ClienteEmail": "",
      "Ciudad": "Querétaro",
      "Conceptos_JSON": "[{\"cantidad\":1,\"descripcion\":\"Arrachera marinada\",\"pu\":90,\"importe\":90},{\"cantidad\":1,\"descripcion\":\"Trozo de pierna \",\"pu\":92,\"importe\":92},{\"cantidad\":0.5,\"descripcion\":\"Chorizo español\",\"pu\":90,\"importe\":45},{\"cantidad\":0.5,\"descripcion\":\"Bistec de cerdo entero\",\"pu\":92,\"importe\":46},{\"cantidad\":1,\"descripcion\":\"Trozo al pastor\",\"pu\":90,\"importe\":90}]",
      "Subtotal": 363,
      "IVA": 0,
      "Descuento": 0,
      "Total": 363
    },
    {
      "Timestamp": "12/7/2025 17:25:33",
      "Remision": "20251207-1024",
      "Fecha": "2025-12-07",
      "Cliente": "Alberto",
      "ClienteEmail": "",
      "Ciudad": "Querétaro",
      "Conceptos_JSON": "[{\"cantidad\":2,\"descripcion\":\"Arrachera marinada\",\"pu\":90,\"importe\":180},{\"cantidad\":1,\"descripcion\":\"Trozo de pierna\",\"pu\":92,\"importe\":92}]",
      "Subtotal": 272,
      "IVA": 0,
      "Descuento": 0,
      "Total": 272
    },
    {
      "Timestamp": "12/9/2025 1:36:11",
      "Remision": "20251208-1835",
      "Fecha": "2025-12-08",
      "Cliente": "Tacos memo",
      "ClienteEmail": "",
      "Ciudad": "Querétaro",
      "Conceptos_JSON": "[{\"cantidad\":8,\"descripcion\":\"Arrachera marinada\",\"pu\":100,\"importe\":800},{\"cantidad\":1,\"descripcion\":\"Bistec de res \",\"pu\":180,\"importe\":180}]",
      "Subtotal": 980,
      "IVA": 0,
      "Descuento": 0,
      "Total": 980
    },
    {
      "Timestamp": "12/9/2025 22:37:55",
      "Remision": "20251209-1536",
      "Fecha": "2025-12-09",
      "Cliente": "Arqui",
      "ClienteEmail": "",
      "Ciudad": "Querétaro",
      "Conceptos_JSON": "[{\"cantidad\":3,\"descripcion\":\"Chorizo argentino\",\"pu\":99,\"importe\":297},{\"cantidad\":5,\"descripcion\":\"Arrachera marinada\",\"pu\":108,\"importe\":540},{\"cantidad\":2,\"descripcion\":\"Bistec adobado taquero\",\"pu\":99,\"importe\":198},{\"cantidad\":2,\"descripcion\":\"Aguja marinada\",\"pu\":126,\"importe\":252},{\"cantidad\":1,\"descripcion\":\"Trozo al pastor\",\"pu\":99,\"importe\":99}]",
      "Subtotal": 1386,
      "IVA": 0,
      "Descuento": 6,
      "Total": 1380
    },
    {
      "Timestamp": "12/9/2025 22:40:22",
      "Remision": "20251209-1538",
      "Fecha": "2025-12-09",
      "Cliente": "Arqui",
      "ClienteEmail": "",
      "Ciudad": "Querétaro",
      "Conceptos_JSON": "[{\"cantidad\":3,\"descripcion\":\"Chorizo argentino\",\"pu\":110,\"importe\":330},{\"cantidad\":5,\"descripcion\":\"Arrachera marinada\",\"pu\":120,\"importe\":600},{\"cantidad\":2,\"descripcion\":\"Bistec adobado taquero\",\"pu\":110,\"importe\":220},{\"cantidad\":2,\"descripcion\":\"Aguja marinada\",\"pu\":140,\"importe\":280},{\"cantidad\":1,\"descripcion\":\"Trozo al pastor\",\"pu\":110,\"importe\":110}]",
      "Subtotal": 1540,
      "IVA": 0,
      "Descuento": 160,
      "Total": 1380
    },
    {
      "Timestamp": "12/10/2025 17:42:15",
      "Remision": "20251210-1041",
      "Fecha": "2025-12-10",
      "Cliente": "Carnes el rey",
      "ClienteEmail": "",
      "Ciudad": "Querétaro",
      "Conceptos_JSON": "[{\"cantidad\":2,\"descripcion\":\"Chorizo español\",\"pu\":110,\"importe\":220}]",
      "Subtotal": 220,
      "IVA": 0,
      "Descuento": 22,
      "Total": 198
    },
    {
      "Timestamp": "12/10/2025 19:07:59",
      "Remision": "20251210-1207",
      "Fecha": "2025-12-10",
      "Cliente": "Alberto",
      "ClienteEmail": "",
      "Ciudad": "Querétaro",
      "Conceptos_JSON": "[{\"cantidad\":1,\"descripcion\":\"Bistec de cerdo entero\",\"pu\":92,\"importe\":92},{\"cantidad\":1,\"descripcion\":\"Pulpa/ trozo de cerdo \",\"pu\":92,\"importe\":92}]",
      "Subtotal": 184,
      "IVA": 0,
      "Descuento": 0,
      "Total": 184
    },
    {
      "Timestamp": "12/10/2025 21:33:18",
      "Remision": "20251210-1432",
      "Fecha": "2025-12-10",
      "Cliente": "Alejandro",
      "ClienteEmail": "",
      "Ciudad": "Querétaro",
      "Conceptos_JSON": "[{\"cantidad\":50,\"descripcion\":\"Arrachera marinada\",\"pu\":81,\"importe\":4050}]",
      "Subtotal": 4050,
      "IVA": 0,
      "Descuento": 0,
      "Total": 4050
    },
    {
      "Timestamp": "12/11/2025 2:18:40",
      "Remision": "20251210-1918",
      "Fecha": "2025-12-10",
      "Cliente": "Grammer",
      "ClienteEmail": "",
      "Ciudad": "Querétaro",
      "Conceptos_JSON": "[{\"cantidad\":10,\"descripcion\":\"Bistec de cerdo entero\",\"pu\":80,\"importe\":800}]",
      "Subtotal": 800,
      "IVA": 0,
      "Descuento": 0,
      "Total": 800
    },
    {
      "Timestamp": "12/11/2025 22:06:10",
      "Remision": "20251211-1505",
      "Fecha": "2025-12-11",
      "Cliente": "Guaches ",
      "ClienteEmail": "",
      "Ciudad": "Querétaro",
      "Conceptos_JSON": "[{\"cantidad\":50,\"descripcion\":\"Arrachera marinada\",\"pu\":82,\"importe\":4100}]",
      "Subtotal": 4100,
      "IVA": 0,
      "Descuento": 0,
      "Total": 4100
    },
    {
      "Timestamp": "12/11/2025 22:08:36",
      "Remision": "20251211-1506",
      "Fecha": "2025-12-11",
      "Cliente": "Carnes el rey",
      "ClienteEmail": "",
      "Ciudad": "Querétaro",
      "Conceptos_JSON": "[{\"cantidad\":10,\"descripcion\":\"Arrachera marinada\",\"pu\":120,\"importe\":1200},{\"cantidad\":3,\"descripcion\":\"Chorizo español\",\"pu\":110,\"importe\":330},{\"cantidad\":2,\"descripcion\":\"Bistec adobado taquero\",\"pu\":110,\"importe\":220}]",
      "Subtotal": 1750,
      "IVA": 0,
      "Descuento": 175,
      "Total": 1575
    },
    {
      "Timestamp": "12/12/2025 0:54:29",
      "Remision": "20251211-1753",
      "Fecha": "2025-12-11",
      "Cliente": "Tacos memo",
      "ClienteEmail": "",
      "Ciudad": "Querétaro",
      "Conceptos_JSON": "[{\"cantidad\":12,\"descripcion\":\"Arrachera marinada\",\"pu\":100,\"importe\":1200},{\"cantidad\":2,\"descripcion\":\"Chuleta ahumada\",\"pu\":95,\"importe\":190},{\"cantidad\":2,\"descripcion\":\"Bistec de cerdo entero\",\"pu\":90,\"importe\":180}]",
      "Subtotal": 1570,
      "IVA": 0,
      "Descuento": 0,
      "Total": 1570
    },
    {
      "Timestamp": "12/12/2025 0:59:16",
      "Remision": "20251211-1757",
      "Fecha": "2025-12-11",
      "Cliente": "Jonathan",
      "ClienteEmail": "",
      "Ciudad": "Querétaro",
      "Conceptos_JSON": "[{\"cantidad\":5,\"descripcion\":\"Arrachera marinada\",\"pu\":100,\"importe\":500},{\"cantidad\":2,\"descripcion\":\"Chorizo argentino\",\"pu\":100,\"importe\":200},{\"cantidad\":2,\"descripcion\":\"Chorizo español\",\"pu\":100,\"importe\":200},{\"cantidad\":3,\"descripcion\":\"Aguja marinada\",\"pu\":120,\"importe\":360},{\"cantidad\":1,\"descripcion\":\"Queso\",\"pu\":100,\"importe\":100},{\"cantidad\":1,\"descripcion\":\"Salsa de piña\",\"pu\":110,\"importe\":110}]",
      "Subtotal": 1470,
      "IVA": 0,
      "Descuento": 0,
      "Total": 1470
    },
    {
      "Timestamp": "12/15/2025 18:26:12",
      "Remision": "20251215-1125",
      "Fecha": "2025-12-15",
      "Cliente": "Guaches",
      "ClienteEmail": "",
      "Ciudad": "Querétaro",
      "Conceptos_JSON": "[{\"cantidad\":50,\"descripcion\":\"Arrachera marinada\",\"pu\":82,\"importe\":4100}]",
      "Subtotal": 4100,
      "IVA": 0,
      "Descuento": 0,
      "Total": 4100
    },
    {
      "Timestamp": "12/15/2025 18:26:48",
      "Remision": "20251215-1126",
      "Fecha": "2025-12-15",
      "Cliente": "Alejandro",
      "ClienteEmail": "",
      "Ciudad": "Querétaro",
      "Conceptos_JSON": "[{\"cantidad\":50,\"descripcion\":\"Arrachera marinada\",\"pu\":81,\"importe\":4050}]",
      "Subtotal": 4050,
      "IVA": 0,
      "Descuento": 0,
      "Total": 4050
    },
    {
      "Timestamp": "12/17/2025 16:53:16",
      "Remision": "20251217-0952",
      "Fecha": "2025-12-17",
      "Cliente": "Grammer",
      "ClienteEmail": "",
      "Ciudad": "Querétaro",
      "Conceptos_JSON": "[{\"cantidad\":161,\"descripcion\":\"Arrachera marinada\",\"pu\":98,\"importe\":15778},{\"cantidad\":7,\"descripcion\":\"Bistec de cerdo entero\",\"pu\":80,\"importe\":560}]",
      "Subtotal": 16338,
      "IVA": 0,
      "Descuento": 0,
      "Total": 16338
    },
    {
      "Timestamp": "12/17/2025 16:55:06",
      "Remision": "20251217-0953",
      "Fecha": "2025-12-17",
      "Cliente": "Grammer",
      "ClienteEmail": "",
      "Ciudad": "Querétaro",
      "Conceptos_JSON": "[{\"cantidad\":46,\"descripcion\":\"Pulpa/trozo cerdo\",\"pu\":80,\"importe\":3680},{\"cantidad\":38,\"descripcion\":\"Bistec de res\",\"pu\":135,\"importe\":5130},{\"cantidad\":7,\"descripcion\":\"Bistec de cerdo entero\",\"pu\":80,\"importe\":560}]",
      "Subtotal": 9370,
      "IVA": 0,
      "Descuento": 0,
      "Total": 9370
    },
    {
      "Timestamp": "12/17/2025 21:35:08",
      "Remision": "20251217-1431",
      "Fecha": "2025-12-17",
      "Cliente": "Tecos el rey",
      "ClienteEmail": "",
      "Ciudad": "Querétaro",
      "Conceptos_JSON": "[{\"cantidad\":3,\"descripcion\":\"Aguja marinada\",\"pu\":140,\"importe\":420},{\"cantidad\":3,\"descripcion\":\"Chorizo argentino\",\"pu\":110,\"importe\":330},{\"cantidad\":3,\"descripcion\":\"Chorizo español\",\"pu\":110,\"importe\":330},{\"cantidad\":2,\"descripcion\":\"Bistec de cerdo entero\",\"pu\":110,\"importe\":220},{\"cantidad\":3,\"descripcion\":\"Arrachera marinada\",\"pu\":120,\"importe\":360}]",
      "Subtotal": 1660,
      "IVA": 0,
      "Descuento": 170,
      "Total": 1490
    },
    {
      "Timestamp": "12/18/2025 23:18:36",
      "Remision": "20251218-1618",
      "Fecha": "2025-12-18",
      "Cliente": "Guaches",
      "ClienteEmail": "",
      "Ciudad": "Querétaro",
      "Conceptos_JSON": "[{\"cantidad\":10,\"descripcion\":\"Arrachera marinada\",\"pu\":82,\"importe\":820}]",
      "Subtotal": 820,
      "IVA": 0,
      "Descuento": 0,
      "Total": 820
    },
    {
      "Timestamp": "12/18/2025 23:19:33",
      "Remision": "20251218-1619",
      "Fecha": "2025-12-18",
      "Cliente": "Alejandro",
      "ClienteEmail": "",
      "Ciudad": "Querétaro",
      "Conceptos_JSON": "[{\"cantidad\":20,\"descripcion\":\"Arrachera marinada\",\"pu\":81,\"importe\":1620}]",
      "Subtotal": 1620,
      "IVA": 0,
      "Descuento": 0,
      "Total": 1620
    },
    {
      "Timestamp": "12/19/2025 20:19:11",
      "Remision": "20251219-1318",
      "Fecha": "2025-12-19",
      "Cliente": "Grammer",
      "ClienteEmail": "",
      "Ciudad": "Querétaro",
      "Conceptos_JSON": "[{\"cantidad\":40,\"descripcion\":\"Pulpa/ trozo de cerdo\",\"pu\":80,\"importe\":3200}]",
      "Subtotal": 3200,
      "IVA": 0,
      "Descuento": 0,
      "Total": 3200
    },
    {
      "Timestamp": "12/19/2025 20:20:09",
      "Remision": "20251219-1319",
      "Fecha": "2025-12-19",
      "Cliente": "Servilamina",
      "ClienteEmail": "",
      "Ciudad": "Querétaro",
      "Conceptos_JSON": "[{\"cantidad\":2,\"descripcion\":\"Bistec de cerdo entero\",\"pu\":80,\"importe\":160},{\"cantidad\":1,\"descripcion\":\"Arrachera marinada\",\"pu\":98,\"importe\":98},{\"cantidad\":3,\"descripcion\":\"Pulpa/ trozo de cerdo\",\"pu\":80,\"importe\":240}]",
      "Subtotal": 498,
      "IVA": 0,
      "Descuento": 0,
      "Total": 498
    },
    {
      "Timestamp": "12/19/2025 23:36:31",
      "Remision": "20251219-1635",
      "Fecha": "2025-12-19",
      "Cliente": "Los papis",
      "ClienteEmail": "",
      "Ciudad": "Querétaro",
      "Conceptos_JSON": "[{\"cantidad\":35,\"descripcion\":\"Arrachera marinada\",\"pu\":90,\"importe\":3150},{\"cantidad\":10,\"descripcion\":\"Bistec de cerdo entero\",\"pu\":92,\"importe\":920},{\"cantidad\":9,\"descripcion\":\"Bistec picado\",\"pu\":92,\"importe\":828},{\"cantidad\":2,\"descripcion\":\"Chuleta ahumada\",\"pu\":95,\"importe\":190}]",
      "Subtotal": 5088,
      "IVA": 0,
      "Descuento": 0,
      "Total": 5088
    },
    {
      "Timestamp": "12/20/2025 1:14:14",
      "Remision": "20251219-1812",
      "Fecha": "2025-12-19",
      "Cliente": "Oscar vazquez",
      "ClienteEmail": "",
      "Ciudad": "Querétaro",
      "Conceptos_JSON": "[{\"cantidad\":34,\"descripcion\":\"Arrachera marinada\",\"pu\":120,\"importe\":4080},{\"cantidad\":2,\"descripcion\":\"New york\",\"pu\":240,\"importe\":480},{\"cantidad\":1,\"descripcion\":\"Aguja marinada\",\"pu\":140,\"importe\":140},{\"cantidad\":5,\"descripcion\":\"Chistorra \",\"pu\":120,\"importe\":600},{\"cantidad\":6,\"descripcion\":\"Chorizo español\",\"pu\":110,\"importe\":660},{\"cantidad\":7,\"descripcion\":\"Chorizo argentino\",\"pu\":110,\"importe\":770}]",
      "Subtotal": 6730,
      "IVA": 0,
      "Descuento": 0,
      "Total": 6730
    },
    {
      "Timestamp": "12/20/2025 1:17:15",
      "Remision": "20251219-1814",
      "Fecha": "2025-12-19",
      "Cliente": "Oscar vazquwz",
      "ClienteEmail": "",
      "Ciudad": "Querétaro",
      "Conceptos_JSON": "[{\"cantidad\":34,\"descripcion\":\"Arrachera marinada \",\"pu\":120,\"importe\":4080},{\"cantidad\":2,\"descripcion\":\"New york\",\"pu\":250,\"importe\":500},{\"cantidad\":1,\"descripcion\":\"Aguja marinada\",\"pu\":140,\"importe\":140},{\"cantidad\":5,\"descripcion\":\"Chistorra\",\"pu\":130,\"importe\":650},{\"cantidad\":6,\"descripcion\":\"Chorizo español\",\"pu\":110,\"importe\":660},{\"cantidad\":7,\"descripcion\":\"Chorizo argentino\",\"pu\":110,\"importe\":770}]",
      "Subtotal": 6800,
      "IVA": 0,
      "Descuento": 1004,
      "Total": 5796
    },
    {
      "Timestamp": "12/20/2025 4:04:44",
      "Remision": "20251219-2102",
      "Fecha": "2025-12-19",
      "Cliente": "Jonathan",
      "ClienteEmail": "",
      "Ciudad": "Querétaro",
      "Conceptos_JSON": "[{\"cantidad\":14,\"descripcion\":\"Arrachera marinada\",\"pu\":100,\"importe\":1400},{\"cantidad\":2,\"descripcion\":\"Salsa de piña\",\"pu\":110,\"importe\":220},{\"cantidad\":3,\"descripcion\":\"Aguja marinada\",\"pu\":120,\"importe\":360},{\"cantidad\":2,\"descripcion\":\"Chorizo argentino\",\"pu\":100,\"importe\":200},{\"cantidad\":2,\"descripcion\":\"Chorizo español\",\"pu\":100,\"importe\":200},{\"cantidad\":3,\"descripcion\":\"Queso\",\"pu\":100,\"importe\":300}]",
      "Subtotal": 2680,
      "IVA": 0,
      "Descuento": 0,
      "Total": 2680
    },
    {
      "Timestamp": "12/20/2025 16:18:28",
      "Remision": "20251220-0918",
      "Fecha": "2025-12-20",
      "Cliente": "Grammer",
      "ClienteEmail": "",
      "Ciudad": "Querétaro",
      "Conceptos_JSON": "[{\"cantidad\":35,\"descripcion\":\"Pulpa/ trozo de cerdo\",\"pu\":80,\"importe\":2800}]",
      "Subtotal": 2800,
      "IVA": 0,
      "Descuento": 0,
      "Total": 2800
    },
    {
      "Timestamp": "12/21/2025 1:43:23",
      "Remision": "20251220-1842",
      "Fecha": "2025-12-20",
      "Cliente": "Jonathan",
      "ClienteEmail": "",
      "Ciudad": "Querétaro",
      "Conceptos_JSON": "[{\"cantidad\":6,\"descripcion\":\"Arrachera marinada\",\"pu\":100,\"importe\":600},{\"cantidad\":1,\"descripcion\":\"Salsa de piña\",\"pu\":110,\"importe\":110}]",
      "Subtotal": 710,
      "IVA": 0,
      "Descuento": 0,
      "Total": 710
    },
    {
      "Timestamp": "12/22/2025 4:01:03",
      "Remision": "20251221-2100",
      "Fecha": "2025-12-21",
      "Cliente": "Tacos el rey",
      "ClienteEmail": "",
      "Ciudad": "Querétaro",
      "Conceptos_JSON": "[{\"cantidad\":4,\"descripcion\":\"Arrachera marinada\",\"pu\":120,\"importe\":480},{\"cantidad\":2,\"descripcion\":\"Aguja marinada\",\"pu\":140,\"importe\":280},{\"cantidad\":4,\"descripcion\":\"Chorizo argentino\",\"pu\":110,\"importe\":440},{\"cantidad\":4,\"descripcion\":\"Chorizo español\",\"pu\":110,\"importe\":440}]",
      "Subtotal": 1640,
      "IVA": 0,
      "Descuento": 164,
      "Total": 1476
    },
    {
      "Timestamp": "12/23/2025 6:41:43",
      "Remision": "20251222-2340",
      "Fecha": "2025-12-22",
      "Cliente": "Tacos memo",
      "ClienteEmail": "",
      "Ciudad": "Querétaro",
      "Conceptos_JSON": "[{\"cantidad\":10,\"descripcion\":\"Arrachera marinada\",\"pu\":100,\"importe\":1000},{\"cantidad\":2,\"descripcion\":\"Bistec de cerdo entero\",\"pu\":90,\"importe\":180},{\"cantidad\":1,\"descripcion\":\"Chuleta ahumada\",\"pu\":95,\"importe\":95}]",
      "Subtotal": 1275,
      "IVA": 0,
      "Descuento": 0,
      "Total": 1275
    },
    {
      "Timestamp": "12/23/2025 23:37:44",
      "Remision": "20251223-1637",
      "Fecha": "2025-12-23",
      "Cliente": "Guches",
      "ClienteEmail": "",
      "Ciudad": "Querétaro",
      "Conceptos_JSON": "[{\"cantidad\":20,\"descripcion\":\"Arrachera marinada\",\"pu\":82,\"importe\":1640}]",
      "Subtotal": 1640,
      "IVA": 0,
      "Descuento": 0,
      "Total": 1640
    },
    {
      "Timestamp": "12/23/2025 23:38:42",
      "Remision": "20251223-1637",
      "Fecha": "2025-12-23",
      "Cliente": "Guaches",
      "ClienteEmail": "",
      "Ciudad": "Querétaro",
      "Conceptos_JSON": "[{\"cantidad\":50,\"descripcion\":\"Arrachera marinada\",\"pu\":82,\"importe\":4100}]",
      "Subtotal": 4100,
      "IVA": 0,
      "Descuento": 0,
      "Total": 4100
    },
    {
      "Timestamp": "12/23/2025 23:39:47",
      "Remision": "20251223-1639",
      "Fecha": "2025-12-23",
      "Cliente": "Los papis",
      "ClienteEmail": "",
      "Ciudad": "Querétaro",
      "Conceptos_JSON": "[{\"cantidad\":10,\"descripcion\":\"Bistec picado\",\"pu\":92,\"importe\":920}]",
      "Subtotal": 920,
      "IVA": 0,
      "Descuento": 0,
      "Total": 920
    },
    {
      "Timestamp": "12/25/2025 5:26:42",
      "Remision": "20251224-2226",
      "Fecha": "2025-12-24",
      "Cliente": "Alejandro",
      "ClienteEmail": "",
      "Ciudad": "Querétaro",
      "Conceptos_JSON": "[{\"cantidad\":30,\"descripcion\":\"Arrachera marinada\",\"pu\":81,\"importe\":2430}]",
      "Subtotal": 2430,
      "IVA": 0,
      "Descuento": 0,
      "Total": 2430
    },
    {
      "Timestamp": "12/26/2025 3:17:57",
      "Remision": "20251225-2016",
      "Fecha": "2025-12-25",
      "Cliente": "Tacos el rey",
      "ClienteEmail": "",
      "Ciudad": "Querétaro",
      "Conceptos_JSON": "[{\"cantidad\":5,\"descripcion\":\"Arrachera marinada\",\"pu\":120,\"importe\":600},{\"cantidad\":5,\"descripcion\":\"Chorizo argentino\",\"pu\":110,\"importe\":550},{\"cantidad\":5,\"descripcion\":\"Chorizo español\",\"pu\":110,\"importe\":550},{\"cantidad\":3,\"descripcion\":\"Aguja marinada\",\"pu\":140,\"importe\":420}]",
      "Subtotal": 2120,
      "IVA": 0,
      "Descuento": 220,
      "Total": 1900
    },
    {
      "Timestamp": "12/26/2025 16:11:46",
      "Remision": "20251226-0910",
      "Fecha": "2025-12-26",
      "Cliente": "Grammer",
      "ClienteEmail": "",
      "Ciudad": "Querétaro",
      "Conceptos_JSON": "[{\"cantidad\":52,\"descripcion\":\"Bistec de cerdo entero\",\"pu\":80,\"importe\":4160},{\"cantidad\":25,\"descripcion\":\"Chuleta ahumada\",\"pu\":95,\"importe\":2375}]",
      "Subtotal": 6535,
      "IVA": 0,
      "Descuento": 0,
      "Total": 6535
    },
    {
      "Timestamp": "12/26/2025 16:12:51",
      "Remision": "20251226-0912",
      "Fecha": "2025-12-26",
      "Cliente": "Grammer",
      "ClienteEmail": "",
      "Ciudad": "Querétaro",
      "Conceptos_JSON": "[{\"cantidad\":7,\"descripcion\":\"Bistec de cerdo entero\",\"pu\":80,\"importe\":560}]",
      "Subtotal": 560,
      "IVA": 0,
      "Descuento": 0,
      "Total": 560
    },
    {
      "Timestamp": "12/26/2025 16:13:57",
      "Remision": "20251226-0912",
      "Fecha": "2025-12-26",
      "Cliente": "Servilamina",
      "ClienteEmail": "",
      "Ciudad": "Querétaro",
      "Conceptos_JSON": "[{\"cantidad\":2,\"descripcion\":\"Bistec de cerdo entero\",\"pu\":80,\"importe\":160},{\"cantidad\":2,\"descripcion\":\"Bistec de res\",\"pu\":135,\"importe\":270},{\"cantidad\":3,\"descripcion\":\"Cuero delgado\",\"pu\":25,\"importe\":75}]",
      "Subtotal": 505,
      "IVA": 0,
      "Descuento": 0,
      "Total": 505
    },
    {
      "Timestamp": "12/27/2025 0:11:41",
      "Remision": "20251226-1711",
      "Fecha": "2025-12-26",
      "Cliente": "Guaches",
      "ClienteEmail": "",
      "Ciudad": "Querétaro",
      "Conceptos_JSON": "[{\"cantidad\":20,\"descripcion\":\"Arrachera marinada\",\"pu\":82,\"importe\":1640}]",
      "Subtotal": 1640,
      "IVA": 0,
      "Descuento": 0,
      "Total": 1640
    },
    {
      "Timestamp": "12/29/2025 18:02:59",
      "Remision": "20251229-1101",
      "Fecha": "2025-12-29",
      "Cliente": "Los papis",
      "ClienteEmail": "",
      "Ciudad": "Querétaro",
      "Conceptos_JSON": "[{\"cantidad\":10,\"descripcion\":\"Bistec picado\",\"pu\":92,\"importe\":920},{\"cantidad\":20,\"descripcion\":\"Arrachera marinada\",\"pu\":90,\"importe\":1800}]",
      "Subtotal": 2720,
      "IVA": 0,
      "Descuento": 0,
      "Total": 2720
    },
    {
      "Timestamp": "12/31/2025 4:15:00",
      "Remision": "20251230-2114",
      "Fecha": "2025-12-30",
      "Cliente": "Guaches",
      "ClienteEmail": "",
      "Ciudad": "Querétaro",
      "Conceptos_JSON": "[{\"cantidad\":24,\"descripcion\":\"Arrachera marinada\",\"pu\":82,\"importe\":1968}]",
      "Subtotal": 1968,
      "IVA": 0,
      "Descuento": 0,
      "Total": 1968
    },
    {
      "Timestamp": "12/31/2025 4:16:00",
      "Remision": "20251230-2114",
      "Fecha": "2025-12-28",
      "Cliente": "Guaches",
      "ClienteEmail": "",
      "Ciudad": "Querétaro",
      "Conceptos_JSON": "[{\"cantidad\":30,\"descripcion\":\"Arrachera marinada\",\"pu\":82,\"importe\":2460}]",
      "Subtotal": 2460,
      "IVA": 0,
      "Descuento": 0,
      "Total": 2460
    },
    {
      "Timestamp": "12/31/2025 4:21:15",
      "Remision": "20251230-2120",
      "Fecha": "2025-12-30",
      "Cliente": "Alejandro",
      "ClienteEmail": "",
      "Ciudad": "Querétaro",
      "Conceptos_JSON": "[{\"cantidad\":15,\"descripcion\":\"Arrachera marinada\",\"pu\":81,\"importe\":1215}]",
      "Subtotal": 1215,
      "IVA": 0,
      "Descuento": 0,
      "Total": 1215
    }
  ]
}